"DESCRIPTION","DURATION IN MS","NAME","PARENT SUITE","START TIME","STATUS","STOP TIME","SUB SUITE","SUITE","TEST CLASS","TEST METHOD"
"","691","User retrieves a book by ID","","Thu Jan 02 16:59:24 GMT 2025","broken","Thu Jan 02 16:59:25 GMT 2025","","API Testing to Retrieve Book Details","API Testing to Retrieve Book Details","User retrieves a book by ID"
"","1303","Successfully delete a book by ID","","Thu Jan 02 16:59:13 GMT 2025","failed","Thu Jan 02 16:59:14 GMT 2025","","API Testing to Delete Books Data","API Testing to Delete Books Data","Successfully delete a book by ID"
"","430","Retrieve a list of books as a user","","Thu Jan 02 16:59:19 GMT 2025","failed","Thu Jan 02 16:59:19 GMT 2025","","API Testing to Retrieve All Books","API Testing to Retrieve All Books","Retrieve a list of books as a user"
"","729","User retrieves a non-existent book","","Thu Jan 02 16:59:26 GMT 2025","broken","Thu Jan 02 16:59:26 GMT 2025","","API Testing to Retrieve Book Details","API Testing to Retrieve Book Details","User retrieves a non-existent book"
"","316","Retrieve a list of books as an admin","","Thu Jan 02 16:59:19 GMT 2025","failed","Thu Jan 02 16:59:20 GMT 2025","","API Testing to Retrieve All Books","API Testing to Retrieve All Books","Retrieve a list of books as an admin"
"","665","Admin retrieves a book by ID","","Thu Jan 02 16:59:23 GMT 2025","broken","Thu Jan 02 16:59:24 GMT 2025","","API Testing to Retrieve Book Details","API Testing to Retrieve Book Details","Admin retrieves a book by ID"
"","531","Attempt to delete a book with a non-existence ID","","Thu Jan 02 16:59:14 GMT 2025","failed","Thu Jan 02 16:59:15 GMT 2025","","API Testing to Delete Books Data","API Testing to Delete Books Data","Attempt to delete a book with a non-existence ID"
"","553","Attempt to delete a book without proper authorization","","Thu Jan 02 16:59:15 GMT 2025","failed","Thu Jan 02 16:59:15 GMT 2025","","API Testing to Delete Books Data","API Testing to Delete Books Data","Attempt to delete a book without proper authorization"
"","720","Admin retrieves a non-existent book","","Thu Jan 02 16:59:25 GMT 2025","broken","Thu Jan 02 16:59:26 GMT 2025","","API Testing to Retrieve Book Details","API Testing to Retrieve Book Details","Admin retrieves a non-existent book"
